id,conversation_id,user_query,agent_reply,all expterts response,rouge
1,1,"Hi, I'm looking to get motor insurance for my new electric vehicle. It's a 2024 Tesla Model 3.","Great choice! The Tesla Model 3 is an excellent vehicle. Since you've opted for an EV, are you particularly interested in coverage specific to electric vehicles, like battery protection?","Agent: Great choice! The Tesla Model 3 is an excellent vehicle. Since you've opted for an EV, are you particularly interested in coverage specific to electric vehicles, like battery protection? Given the provided information, here is the final response crafted without repeating or referencing the expert outputs: Agent: Great choice! The Tesla Model 3 is an excellent vehicle. Since you've opted for an EV, are you particularly interested in coverage specific to electric vehicles, like battery protection? This response acknowledges",0.5357142857142857
2,1,"Yes, battery protection is definitely a concern. It's a big investment, and I want to make sure it's covered.","Absolutely. The battery is the heart of your Tesla. With Tata AIG, you get rapid claims resolution combining thorough coverage with rapid claims resolution. It integrates technology with traditional risk management practices, ensuring that claims are processed quickly and effectively.","Absolutely, the battery is the heart of your Tesla. With Tata AIG, you'll enjoy rapid claims resolution, which combines thorough coverage with quick and efficient processing. Our approach blends modern technology with traditional risk management practices to ensure your claims are handled swiftly and effectively. Absolutely, the battery is the heart of your Tesla. With Tata AIG, you'll benefit from rapid claims resolution, which combines thorough coverage with quick and efficient processing. Our approach integrates modern technology with traditional risk management practices",0.5806451612903225
3,1,What kind of coverage options do you have specifically for EVs?,"We offer a comprehensive plan that includes coverage for accidental damage, theft, and third-party liability. More importantly, we offer add-ons like Zero Depreciation Cover and Engine & Gearbox Protection. And our online policy management system makes everything simple for someone like you.","Got it — we have a thorough plan that covers accidental damage, theft, and third party liability. Plus, we offer extra protections like Zero Depreciation Cover and Engine & Gearbox Protection. Our online system also makes managing your policy easy. Let me know if you have any more questions!",0.6444444444444444
4,1,"Okay, that sounds pretty good. Can you give me a quote?","Sure. For a 2024 Tesla Model 3 with comprehensive coverage including battery protection and roadside assistance, the annual premium would be approximately $2800. This includes a discount for purchasing the policy online.","Certainly, for a 2024 Tesla Model 3 with comprehensive coverage, including battery protection and roadside assistance, the annual premium would be around $2800, with a discount available for online purchases. This pricing covers everything needed to ensure your vehicle is protected.Certainly, for a 2024 Tesla Model 3 with comprehensive coverage, including battery protection and roadside assistance, the annual premium would be around $2800, with a discount",0.5858585858585859
5,1,That's within my budget. What's the claim process like if I need to use it?,"The claim process is designed to be as smooth and hassle-free as possible. Accidents are unpredictable, but the financial stress doesn’t have to be. We offer prompt claims settlement, so you can focus on recovery, not paperwork. Our team is available 24/7 to guide you through the process.","Thank you for reaching out. I understand that accidents can be stressful, but our claim process is designed to be as smooth and hassle free as possible. We aim to settle claims quickly so you can focus on your recovery, not paperwork. Our team is always here, 24/7, to guide you through every step. Rest assured, we’re here to support you.",0.6491228070175439
7,2,"Hi, I'm looking to get insurance for my bike. It's a 2022 Royal Enfield Interceptor 650.","The Interceptor 650 is an excellent bike! As a professional, do you use it mainly for leisure or commuting?","Thank you for the kind words about the Interceptor 650! So, to clarify, are you using this bike primarily for leisure activities or for commuting purposes? Thank you for the kind words about the Interceptor 650! So, to clarify, are you using this bike primarily for leisure activities or for commuting purposes?",0.28169014084507044
8,2,"Mostly for weekend rides, so leisure I guess.","Since you are not a daily commuter, you might not need the most expensive plan out there. However, accidents can still happen, especially on leisure rides. Our comprehensive plan ensures you're financially protected from unexpected damages.","It sounds like you’re considering insurance options, and given that you don’t commute daily, you might not need the most expensive plan. However, accidents can still occur during leisure rides, so having a comprehensive plan can give you peace of mind and financial protection against unexpected damages. Does that help clarify things? If you have any more questions, feel free to ask!",0.5148514851485149
9,2,What's covered in a comprehensive plan?,"It covers damages to your bike from accidents, theft, natural disasters, and third-party liabilities. Tata AIG is designed to address modern vehicle risks, this insurance product combines thorough coverage with rapid claims resolution.","Thank you for asking! This insurance product from Tata AIG covers damages to your bike from various incidents like accidents, theft, natural disasters, and third party liabilities. It also ensures thorough coverage with quick claims resolution, addressing modern vehicle risks effectively. Does anything else need clarification?",0.725
10,2,"Okay, that sounds good. What about roadside assistance?","Roadside assistance is available as part of our comprehensive coverage and offers help if you experience vehicle breakdowns, requiring towing services, tire changes, fuel delivery, or emergency repairs while on the road.","Sure, roadside assistance is included in our comprehensive coverage and can help with various situations like vehicle breakdowns, towing services, tire changes, fuel delivery, or emergency repairs while you're on the road. This service is there to assist you if you encounter any issues while driving. Is there anything specific you need more information about? Sure, roadside assistance is included in our comprehensive coverage and can help with various situations like vehicle breakdowns, towing services, tire changes, fuel delivery, or",0.44247787610619466
11,2,How much would this cost me?,"For a 2022 Royal Enfield Interceptor 650 with comprehensive coverage, it would be approximately $950 annually. And since you only use your bike for leisure, we can offer a discount making it $850 annually.","For a 2022 Royal Enfield Interceptor 650 with comprehensive coverage, it would be approximately $950 annually. Since you only use your bike for leisure, we can offer a discount, making it $850 annually. Does this sound good for your needs? Let me know if you have any other questions!",0.7951807228915663
12,2,That sounds reasonable. I'm happy to pay $850 annually. Please tell me more about the claim process.,It is one of our most sought after policies because it offers excellent value for weekend riders,"It sounds like you're interested in learning more about a popular policy that provides great value specifically for weekend riders. This policy is highly sought after because it offers excellent benefits during those times. Is there anything specific you'd like to know about it? It sounds like you're curious about a popular policy that's very much in demand, especially for weekend riders, and it offers excellent value. If you have any specific questions or need more details, feel free to ask!",0.25490196078431376
14,3,"Hi, I'm looking for a motor insurance policy for my bike. It's a 2022 Royal Enfield Classic 350.","Okay, a Royal Enfield Classic 350 is a great bike! Since you're a professional and likely value your time, would you prefer a policy with quick claim settlements or are you more focused on the lowest possible premium?",Got it! So you're looking for a policy that either prioritizes quick claim settlements for convenience or focuses on the lowest possible premium to save money. Could you give me a bit more detail on which aspect is most important to you? That will help me recommend the best option for you.,0.41304347826086957
15,3,I value my time. Quick claim settlement is important to me.,"I understand. As a professional, you're busy and don't want to be stuck dealing with lengthy claim processes. Bajaj Allianz emphasizes reliability and efficiency, offering extensive vehicle protection while ensuring that claims are settled quickly.","Thank you for your query. Bajaj Allianz focuses on providing reliable and efficient services, ensuring that claim processes are handled swiftly. This means you can expect comprehensive vehicle protection with quick claim settlements, making it easier to manage your needs efficiently. If you have any more questions, feel free to ask! Thank you for your query. Bajaj Allianz focuses on providing reliable and efficient services, ensuring that claim processes are handled swiftly. This means you can expect comprehensive vehicle",0.2931034482758621
16,3,What does this policy typically cover?,"It provides Comprehensive Coverage, Liability Coverage, access to our Network Garages, and excellent Customer Support. This is one of our most popular plans—most of our clients go for it because it offers complete peace of mind for daily drivers","Thank you for sharing those details! It sounds like this plan covers a wide range of aspects, including comprehensive and liability coverage, access to network garages, and excellent customer support. Many of our clients find it offers complete peace of mind for their daily driving needs. If you have any specific questions or need further clarification on any of these features, feel free to ask! We're here to help. Thank you for sharing those details! It sounds like this plan covers a wide range of",0.44444444444444453
17,3,Okay. What would be the premium for this policy?,"For a 2022 Royal Enfield Classic 350, the annual premium would be around $850. This includes quick claim settlements.","Got it — for your 2022 Royal Enfield Classic 350, the annual premium comes to about $850, which covers quick claim settlements. Let me know if you need more details!",0.5416666666666666
18,3,"That sounds good, can I get paperless claim settlement as part of the deal.","Yes, our policy includes paperless claim settlement, streamlining the claims process through digital submissions and verifications, reducing paperwork and expediting claim settlements in an environmentally friendly manner.","Thank you for asking! Our policy indeed includes paperless claim settlement, which streamlines the process through digital submissions and verifications. This approach helps reduce paperwork and expedites claim settlements, all while being environmentally friendly. If you have any more questions, feel free to ask! Thank you for asking! Our policy includes paperless claim settlement, which streamlines the process through digital submissions and verifications. This approach helps reduce paperwork and expedites claim settlements, all while being",0.45098039215686275
20,4,"Hi, I am interested in getting motor insurance for my bike. I just bought a new 2024 Royal Enfield Classic 350.","Congratulations on your new Royal Enfield Classic 350! That's a fantastic bike. As a professional, you value efficiency. ICICI Lombard's plan with Cashless Repairs helps you cut unexpected costs and avoid downtime. It’s a smart choice if you value minimal out-of-pocket expense.","Congratulations on your new Royal Enfield Classic 350! That's a fantastic bike. As someone who values efficiency, it's great to see you considering a plan that can help you manage unexpected costs and minimize downtime. It's definitely a smart choice for keeping your bike running smoothly and staying within your budget. If you have any questions, feel free to ask!",0.6181818181818182
21,4,Cashless repairs sound good. Does the insurance cover theft as well?,"Yes, it does. Our comprehensive policy covers theft, accidents, and any damages from natural disasters. We also offer roadside assistance in case you ever get stranded.","Thank you for the detailed explanation. Our comprehensive policy indeed covers theft, accidents, and damages from natural disasters. Additionally, we provide roadside assistance if you ever find yourself stranded. If you have any more questions or need further clarification, feel free to ask!",0.5217391304347826
22,4,That’s reassuring. What’s the claim process like if something happens?,"With IFFCO Tokio, you’re choosing a provider known for its customer-first approach and streamlined claims resolution. Their policy ensures clarity and speed during stressful times like accidents or thefts.","It sounds like you're looking for more information about IFFCO Tokio and their approach to customer service. They focus on a customer first approach, which means they prioritize your needs. Their streamlined claims resolution process ensures that you get clear and speedy assistance during tough times, like accidents or thefts. If you have any specific questions, feel free to ask!",0.4782608695652174
23,4,"Okay, that sounds pretty good. What would the premium be for the comprehensive policy?","For a 2024 Royal Enfield Classic 350 with comprehensive coverage, the premium would be around $950 per year. This includes coverage for theft, accidents, and natural disasters, as well as roadside assistance.","It sounds like you're really frustrated with losing your phone so frequently. Losing a device can be incredibly annoying. To help manage this, you might consider getting a protective case, using find my phone features, or even adding a tracking app to keep better tabs on it. If you need more assistance, let me know! It sounds like you're really frustrated with losing your phone so frequently. Losing a device can be incredibly annoying. To help manage this, you might consider getting a",0.08547008547008547
24,4,That sounds reasonable. Let me think about it.,"Consider the peace of mind knowing you're fully protected. Accidents are unpredictable, and the financial strain can be significant. Bajaj Allianz offers prompt claims settlement, allowing you to focus on recovery, not paperwork.","It's reassuring to know that Bajaj Allianz provides comprehensive protection with prompt claim settlement, allowing you to concentrate on your recovery rather than handling paperwork. Regular protection can give you peace of mind knowing you're fully covered in case of unexpected accidents. Regular physical activity also plays a crucial role in maintaining good health; engaging in moderate exercise for at least 150 minutes per week can significantly enhance your overall well being.",0.40740740740740744
