id,conversation_id,user_query,agent_reply,all expterts response,rouge
43,8,That's a fair point. What add-ons would you recommend for the comprehensive policy?,"Since you don't drive daily, Roadside Assistance is a great add-on. This ensures that help is available at any time if you experience vehicle breakdowns, requiring towing services, tire changes, fuel delivery, or emergency repairs while on the road.","I appreciate your attention to detail when it comes to your bike's insurance. Comprehensive coverage is indeed a wise choice for someone who values a smooth experience. For the comprehensive policy, I suggest considering add ons like roadside assistance, which can provide help in case of a breakdown, and personal accident cover, which offers protection in the unlikely event of an accident. These can provide peace of mind and ensure you're well protected in various scenarios.",0.18487394957983194
44,8,"Okay, roadside assistance sounds useful. How much would that add to the premium?","Roadside assistance would add approximately $50 to the annual premium. It's a small price to pay for the peace of mind knowing you won't be stranded. Accidents are unpredictable, but the financial stress doesn’t have to be. Bajaj Allianz offers prompt claims settlement, so you can focus on recovery, not paperwork.","Certainly! For the Roadside Assistance add on, it would add approximately an additional $50 to your annual premium, providing you that extra peace of mind when you're out and about on your bike.",0.409090909090909
45,8,"Alright, I'm interested. Can you send me a quote with the comprehensive coverage and roadside assistance?","Absolutely! I'll email you a detailed quote right away. I think you will find that for the price, the peace of mind is well worth it.","Absolutely, I'd be happy to assist with that. I'll send a quote for the comprehensive coverage and include roadside assistance for you. It's a wise decision to consider all your options for peace of mind on the road.",0.4411764705882353
46,9,"Hi, I'm looking to get insurance for my new bike. It's a 2024 Royal Enfield Himalayan.","Congratulations on your new Royal Enfield Himalayan! It's a fantastic bike. As a professional, do you primarily use your bike for leisure or commuting?",Hi there! I'd be happy to help you with that. Getting insurance for your new Royal Enfield Himalayan is a great idea to protect your investment. Let's find you the best motor insurance quote for your bike.,0.34375
47,9,"Mostly leisure, weekend rides. I want something reliable, but I'm also on a budget.","For weekend rides, you’ll want to ensure your bike is protected from accidents and unforeseen circumstances. With IFFCO Tokio, you’re choosing a provider known for its customer-first approach and streamlined claims resolution. Their policy ensures clarity and speed during stressful times like accidents or thefts.","Absolutely, I can help with that! Insurance for your new Royal Enfield Himalayan will be tailored to its use for leisurely weekend rides and within your budget. We have options that provide reliable coverage without breaking the bank. Let's explore your choices together.",0.21739130434782608
48,9,"Okay, good to know. What kind of coverage options do you have for the Himalayan?","We offer both third-party liability and comprehensive coverage. Given your occasional usage and budget considerations, a comprehensive policy is recommended. It covers damage to your bike, as well as third-party liabilities.","Certainly, I'd be happy to detail the coverage options for your Royal Enfield Himalayan. We offer various plans that can align with your leisure use and budget. Our comprehensive coverage ensures peace of mind on your weekend rides, with competitive pricing designed for long term reliability.",0.22499999999999998
49,9,What add-ons are worth considering?,"Since you often embark on weekend trips, consider Roadside Assistance. This service ensures that help is available at any time if you experience vehicle breakdowns, requiring towing services, tire changes, fuel delivery, or emergency repairs while on the road.","Certainly! For your Royal Enfield Himalayan, considering add ons like theft protection or roadside assistance would be beneficial. These can provide extra peace of mind, alongside the comprehensive coverage that's ideal for leisure rides. Let's explore these options to find the best fit for your needs and budget.",0.13483146067415733
50,9,That sounds useful. How much would the comprehensive policy with roadside assistance cost?,"For your 2024 Royal Enfield Himalayan, the comprehensive policy with roadside assistance would be approximately $1200 annually. This plan is affordable and offers complete peace of mind for daily drivers","The comprehensive policy with roadside assistance typically starts at around $150 per month, depending on various factors. It's a smart choice to ensure your weekend adventures are worry free. Would you like to explore this option further with one of our advisors?",0.273972602739726
51,9,"Okay, I'm interested. What's the next step?","Great! I can email you a detailed quote with the policy terms and conditions. We can also discuss payment options. Accidents are unpredictable, but the financial stress doesn’t have to be. Bajaj Allianz offers prompt claims settlement, so you can focus on recovery, not paperwork.","It's great to hear your interest! The next step would be to provide you with the details for the application process. We'll need a few more details, but I'm here to guide you through it. Rest assured, we'll make it smooth and straightforward.",0.3010752688172043
52,10,"Hi, I'm interested in getting motor insurance for my bike. It's a 2022 Yamaha MT-07.","Great choice! The Yamaha MT-07 is a fantastic bike.  Being a professional, your time is valuable. We offer policies with streamlined claims to minimize any disruption to your busy schedule.",Absolutely! I'd be happy to help you explore options for insuring your 2022 Yamaha MT 07. Let's look at the coverage levels and find a plan that best suits your needs.,0.28125
53,10,That's good to know. What kind of coverage options do you have?,"We offer both third-party liability and comprehensive coverage. Since the bike is relatively new, I'd strongly recommend comprehensive coverage to protect against theft, accidents, and other damages.","Absolutely, your Yamaha MT 07 deserves the best coverage! We offer a range of options, from basic liability to comprehensive protection that includes theft and collision. Our aim is to ensure that your unique needs are met, keeping your bike safe and giving you peace of mind. Let's explore these options together to find the perfect fit for you.",0.2921348314606742
54,10,What's the difference in price between the two?,"For your Yamaha MT-07, third-party liability would be around $400 per year, while comprehensive coverage would be about $950. Accidents are unpredictable, but the financial stress doesn’t have to be.","It's great that you're considering insurance for your Yamaha MT 07. The price difference between third party liability and comprehensive coverage can vary based on several factors, including your location and the specific details of the bike. Typically, comprehensive coverage is slightly more expensive due to the broader protection it offers. Would you like to get a personalized quote to see the exact difference for your motorcycle?",0.2549019607843137
55,10,"Okay, that's a significant jump. What does the comprehensive policy actually cover?","Comprehensive coverage includes damage to your bike from accidents (even if it's your fault), theft, fire, vandalism, and natural disasters. It also covers third-party liability if you cause damage to someone else's property or injure them.","Certainly, the comprehensive policy covers a wide range of potential issues, including theft, accidents, and any related damages to your bike, ensuring comprehensive protection. It's definitely worth considering for the peace of mind it provides.",0.3466666666666667
56,10,What about roadside assistance?,"Roadside assistance is an optional add-on. However, IFFCO Tokio is known for its customer-first approach and streamlined claims resolution. Their policy ensures clarity and speed during stressful times.",Roadside assistance is a valuable feature that's included in our comprehensive policy. It provides help in case your bike experiences a breakdown or you need assistance during a trip. Let me know if there's anything else you'd like to know about the policy!,0.13157894736842102
57,10,"Okay, I think I'd like to go with the comprehensive coverage. Can you give me a quote with roadside assistance?","Certainly! With roadside assistance added, the annual premium would be $1100. It's one of our most popular plans—most of our clients go for it because it’s affordable and offers complete peace of mind.","Thank you for your interest in comprehensive coverage for your Yamaha MT 07. Based on your preferences, including roadside assistance, I can provide you a tailored quote to ensure you have peace of mind while enjoying your motorcycle. Let's get started with the details.",0.22222222222222224
58,11,I'm looking to get insurance for my bike. It's a 2022 Royal Enfield Interceptor 650.,"Okay, a 2022 Royal Enfield Interceptor 650. Nice bike! As a professional, you probably value reliability and efficiency. I would recommend Bajaj Allianz for your bike.  ","Absolutely, I'd be happy to help you with that. A 2022 Royal Enfield Interceptor 650 is a fantastic choice. I can guide you through the insurance options that would best suit your bike. Let's get started!",0.37499999999999994
59,11,What makes Bajaj Allianz a good choice?,"Bajaj Allianz offers extensive vehicle protection while ensuring that claims are settled quickly. Additional benefits enhance the overall service, making it a dependable choice for minimizing the financial impact of unforeseen events.","That's a great question! Bajaj Allianz offers comprehensive coverage options tailored to the specific needs of a Royal Enfield Interceptor 650 owner. They prioritize reliability and efficiency in their policies, providing peace of mind and competitive premiums. Additionally, their claim process is known to be straightforward, making it easier for bike owners like yourself to get back on the road quickly.",0.2978723404255319
60,11,What kind of coverage options are available?,"We offer both third-party liability and comprehensive coverage. Given that you are value-seeker and your bike is fairly recent, I would strongly recommend the comprehensive coverage.","I'm glad to hear that you're considering insurance options for your Royal Enfield. Bajaj Allianz provides a comprehensive range of protection plans, including coverage for damages, theft, and third party liabilities. You'll also find additional benefits like roadside assistance and discounts on accessories, which enhance your riding experience. It's designed to give you peace of mind while ensuring financial security in case of unforeseen incidents.",0.22680412371134018
61,11,What does the comprehensive policy cover?,"Comprehensive coverage provides all-round protection by including both own-damage and third-party liabilities. It covers damages to your vehicle due to accidents, theft, natural disasters, fire, and vandalism, offering extensive financial protection beyond just third-party coverage.","Comprehensive policies typically cover damage to your bike from theft, vandalism, and accidents, as well as liability for damages or injuries you might cause to others. This can offer peace of mind, knowing you're fully protected.",0.368421052631579
62,11,That sounds good. What about the claim process?,"Our claim process is designed to be smooth and efficient. We also have a cashless repair network. This feature allows policyholders to have their vehicle repairs handled directly by approved service centers without paying upfront, as costs are settled directly between the insurer and the network garage.","Certainly! Comprehensive coverage is designed to protect you from a wide range of potential incidents. If you need to file a claim, you'll typically need to report the incident to your provider promptly. They'll guide you through the process, which often involves assessing the damage and submitting any required documentation. Bajaj Allianz prides itself on making this process as smooth as possible for their customers.",0.24561403508771934
63,11,And what would be the cost of the comprehensive policy?,"For a 2022 Royal Enfield Interceptor 650, the comprehensive policy would be around $950 per year. With Bajaj Allianz, you’re choosing a provider known for its customer-first approach and streamlined claims resolution","Absolutely, understanding the financial aspect is important. The comprehensive policy premium varies based on several factors, including the value of your bike, your location, and other considerations. I can provide you a personalized quote for your 2022 Royal Enfield Interceptor 650. Would you like to proceed with this?",0.3658536585365854
64,11,"Okay, that seems reasonable. Can you send me a quote?","Absolutely! I'll email you a detailed quote right away. Accidents are unpredictable, but the financial stress doesn’t have to be. We offer prompt claims settlement, so you can focus on recovery, not paperwork.","Sure, I can arrange for a quote to be sent to you. It sounds like you're making a well considered decision, and I'm here to help you with that.",0.24242424242424246
65,12,"Hi, I'm interested in getting a motor insurance quote for my 2022 Royal Enfield Classic 350.","Certainly! The Royal Enfield Classic 350 is a great bike. As a professional, you probably value both reliability and affordability, correct?",Certainly! A quote for your 2022 Royal Enfield Classic 350 can be arranged. I’ll get the details for you right away to ensure you have the coverage you need.,0.3137254901960784
66,12,"Yes, exactly. I don't use it for daily commuting, mostly weekend rides.","Given your occasional usage, a comprehensive plan might be overkill. However, accidents can still happen. Imagine a minor collision on a weekend ride leading to costly repairs. Our standard plan offers sufficient protection without breaking the bank.","Absolutely, I appreciate your details. For your Royal Enfield Classic 350, which is mainly used for weekend rides, we'll factor in a professional rider coverage that balances coverage and cost. Let's proceed with a tailored quote that suits your needs.",0.12658227848101267
67,12,What does the standard plan cover?,"It covers third-party liability, accidental damage to your bike, and theft. Plus, with IFFCO Tokio, you’re choosing a provider known for its customer-first approach and streamlined claims resolution.","The standard plan typically covers accidents that might occur during your weekend rides, including minor collisions. It provides protection against the associated costs of repairs, ensuring you're not left with a heavy financial burden. This can offer you peace of mind while enjoying your motorcycle rides, knowing you have the right coverage for your occasional use.",0.20454545454545456
68,12,"Okay, and how much would that cost?","For your 2022 Royal Enfield Classic 350, the standard plan would be approximately $850 annually. It’s a dependable choice for minimizing the financial impact of unforeseen events.","Absolutely, I'd be happy to provide that information for you. The standard plan for your Royal Enfield Classic 350 would cost [insert specific amount here], ensuring you have the coverage you need for those weekend rides without any worries.",0.3823529411764706
69,12,Are there any discounts available?,"Yes, we offer a digital purchase discount if you buy the policy online. Given you are a professional and most likely tech-savvy, this may be of interest to you.","Absolutely, it's great to see you're considering all angles. We do offer various discounts for different scenarios, such as safe driving records and bundling with other insurance services. I can help you find the most advantageous option for your situation.",0.25
70,12,That sounds good. I'm happy to purchase online.,Excellent! This is one of our popular plans—most of our clients go for it because it’s affordable and offers complete peace of mind for daily drivers,"That's great to hear! I'll process your online purchase right away. Thank you for choosing IFFCO Tokio for your Royal Enfield Classic 350 motor insurance. You've made a smart and secure choice for your weekend adventures. Enjoy the ride, and feel free to reach out if you have any more questions.",0.0975609756097561
71,13,I'm looking to insure my bike. It's a 2022 Yamaha MT-07.,"Okay, a 2022 Yamaha MT-07. Great bike! Do you use it primarily for commuting, or leisure riding?",It sounds like you're ready to protect your Yamaha MT 07 with insurance. I can help you get a quote. Could you provide me with some additional details about your bike and your usage?,0.2641509433962264
72,13,Mostly for commuting to work daily.,"Given that you're using your MT-07 for daily commuting, especially with city traffic, a comprehensive plan is highly recommended. Think about the peace of mind knowing you're covered in case of an accident or theft.","It's wonderful that you're considering insurance for your Yamaha MT 07, especially since it serves as a daily commute. I'll make sure to provide you with options that suit your needs as a commuter. Do you have any specific coverage preferences or questions?",0.3333333333333333
73,13,What does the comprehensive plan cover exactly?,"It covers damages to your bike from accidents, theft, vandalism, and natural disasters. It also includes third-party liability, protecting you if you cause damage to another person or their property.","Absolutely, I'd be happy to explain. A comprehensive plan typically covers damages to your bike from accidents, theft, vandalism, and natural disasters. It may also include liability in case you are responsible for an accident affecting others. Think of it as a safety net to protect you and your MT 07 against unforeseen events.",0.4883720930232559
74,13,"Okay, that sounds good. How about roadside assistance?","Roadside assistance is included in our comprehensive plan. We offer services like towing, jump-starts, and fuel delivery if you ever find yourself stranded.","Absolutely, roadside assistance is indeed part of the comprehensive plan. It offers support in the event of a breakdown or emergency, ensuring that you're not left stranded. This can be a real lifesaver during unexpected situations.",0.2950819672131148
75,13,What company is this through?,"We offer this coverage through Bajaj Allianz, known for reliability and efficient claims settlement. With Bajaj Allianz, you’re choosing a provider known for its customer-first approach and streamlined claims resolution.","Absolutely, I'd be happy to help with that. The comprehensive plan we've discussed is provided through our trusted partner, ABC Insurance. They have a strong reputation for customer service and comprehensive coverage options.",0.26865671641791045
76,13,And the cost?,"For a 2022 Yamaha MT-07 with comprehensive coverage and roadside assistance, the annual premium would be approximately $1100. Since you're a daily commuter, you might also benefit from our telematics-based monitoring for premium discounts.","Certainly, let's look at the cost for the comprehensive plan. It's structured to provide extensive coverage, including all the aspects we discussed, such as accident and theft coverage, and it's specifically tailored to support your daily commuting needs in city traffic. I can assure you that Bajaj Allianz offers competitive rates for the 2022 Yamaha MT 07, ensuring you get the best possible value. Would you like to get a quote tailored to your specific situation?",0.27586206896551724
77,13,Telematics? Tell me more.,"It's a small device that tracks your driving habits. Safe driving can earn you discounts on future premiums, so it pays to be responsible!","I'm glad to hear that you're considering comprehensive coverage. Telematics is a system that monitors your driving habits, like speed and distance traveled. It can provide you with personalized premium discounts based on your driving behavior, which can be quite beneficial for a daily commuter like yourself. It's a valuable feature that helps promote safer driving and can lower your insurance costs.",0.35555555555555557
78,14,"Hi, I'm looking for car insurance for my 2018 Tesla Model 3.","A 2018 Tesla Model 3, excellent choice! Given that it's a premium electric vehicle, are you looking for comprehensive coverage with all the bells and whistles?",Hello! I'd be happy to help you find the right car insurance for your 2018 Tesla Model 3. Let’s get started with that quote!,0.3773584905660377
79,14,"Yes, I want the best protection possible. Money isn't really an issue, but I need to know my car is fully covered.","I understand completely. Peace of mind is priceless, especially with a high-value vehicle. Accidents are unpredictable, but the financial stress doesn’t have to be. We offer prompt claims settlement, so you can focus on recovery, not paperwork.","Absolutely, I completely understand the need for peace of mind when it comes to protecting your vehicle. We can definitely look into comprehensive coverage options that will ensure your Tesla Model 3 is well taken care of. Let's get started on finding the best plan tailored to your needs.",0.2921348314606742
80,14,What kind of coverage are we talking about?,"Our comprehensive coverage includes everything: collision, theft, vandalism, natural disasters, and third-party liability. We also offer add-ons like zero depreciation, which ensures you get the full replacement value for parts in case of a claim.","Absolutely, we offer comprehensive coverage that includes collision, theft, and damage from natural disasters. With your Tesla Model 3, you'll benefit from our premium plan that covers even the most unexpected events, ensuring your peace of mind on the road.",0.3846153846153847
81,14,"Zero depreciation sounds essential. What about coverage for the battery? It's an EV, after all.","Excellent point! Our comprehensive plan specifically covers the battery and other electric vehicle components. Also with IFFCO Tokio, you’re choosing a provider known for its customer-first approach and streamlined claims resolution. Their policy ensures clarity and speed during stressful times like accidents or thefts.","Certainly, zero depreciation is a valuable feature, and for your Tesla Model 3, we do indeed offer specific coverage for the battery, ensuring that you're covered in case of any unexpected issues. It's great to see you're taking such thorough precautions for your EV.",0.21505376344086022
82,14,What's the premium for this level of coverage?,"For a 2018 Tesla Model 3 with comprehensive coverage, zero depreciation, and EV component protection, the annual premium would be around $3500. With features like cashless repair services, it streamlines the claim process, reducing administrative burdens and accelerating service delivery so vehicles can return to service faster.","I understand you're looking for thorough protection for your Tesla Model 3. With comprehensive coverage, you'll receive the best protection, including battery and parts, with the added convenience of zero depreciation. As for the premium, let's discuss the specifics to ensure it aligns with what you expect for such an excellent vehicle. We're here to make sure your peace of mind stays intact.",0.3157894736842105
83,14,That sounds reasonable. What is the Insured Declared Value (IDV)?,"In the case of a total loss, this cover guarantees that the payout will match the original purchase price of the vehicle as per the invoice, rather than the depreciated current value, providing greater financial relief.","It's great to hear that our services meet your needs. The Insured Declared Value, or IDV, is a key factor in determining your premium, as it represents the maximum amount our company will pay for your vehicle in the event of a claim. For your 2018 Tesla Model 3, this will be assessed based on the car's market value, taking into account its make, model, age, and other factors. Our team will provide you with a precise figure to ensure you have the best possible protection.",0.2419354838709677
84,14,Great. How do I proceed with purchasing this policy?,"Excellent! I can email you a detailed policy document and a link to our secure online payment portal.  Or, if you prefer, we can schedule a call to walk through the details together. This is one of our most popular plans - most of our clients go for it because it offers complete peace of mind.","I'm glad you're interested in securing your 2018 Tesla Model 3 with comprehensive coverage. With the zero depreciation add on and EV component protection, you'll enjoy great peace of mind. To get started, our team will assist you with the purchase process. You'll be fully covered, and we're here to make it as smooth as possible. Shall we proceed with the paperwork?",0.22950819672131145
85,15,I need to renew my car insurance. It's for a 2010 Honda Civic.,"Okay, a 2010 Honda Civic. Are you primarily concerned with the lowest possible price, or are there specific coverages you're interested in?",Certainly! I can assist you with renewing your insurance for your 2010 Honda Civic. Let's get the process started.,0.27906976744186046
