id,conversation_id,user_query,agent_reply,all expterts response,rouge
86,15,"I'm on a fixed income, so price is definitely a factor. But I still need decent coverage.","I understand. It’s important to protect yourself without breaking the bank. A third-party liability policy is the most affordable option, covering damages you might cause to others.",Sure thing! I can help you find an insurance quote for your 2010 Honda Civic that balances both affordability and the coverage you need. Let's get started on that.,0.16949152542372883
87,15,What does that actually cover?,It covers damages to another person's vehicle or property if you're at fault in an accident. It doesn't cover damages to your own car.,"Certainly, I'd be happy to explain. Third party liability coverage is focused on damages that you may cause to other people or their property. It's important to know that it doesn't cover any damage to your own car. This type of policy is a fundamental coverage and is required by law in most places, ensuring that you're financially protected in case you're at fault in an accident.",0.44444444444444453
88,15,"Hmm, I see. How much would that cost?","For a 2010 Honda Civic, a third-party liability policy would be approximately $800 per year. With Reliance General Insurance, its user-friendly claim process and focus on customer convenience work together to provide a smooth and reassuring experience during challenging times.","Certainly, I can help with that. The cost for third party liability coverage varies, but for your 2010 Honda Civic, it's generally more affordable than full coverage. Prices can range depending on your location and driving history. Would you like me to look up some quotes for you?",0.2857142857142857
89,15,Is there anything else I should consider?,"Given your age and occasional driving, personal accident cover is worth considering. This rider provides additional financial support in case of serious injury or death resulting from a road accident, covering medical expenses, disability, or loss of income for the insured driver and eligible passengers.","Of course, let's explore some additional options together. Besides the third party liability, you might want to consider comprehensive coverage for broader protection, or maybe some add ons for roadside assistance or accident forgiveness. We can tailor the policy to fit your needs and budget.",0.2197802197802198
90,15,How much would that add to the premium?,"Adding personal accident cover would increase the premium by about $50 per year. Since you’re budget-conscious and prefer simplicity, this policy offers essential protection at an affordable price point.","Certainly! Adding personal accident cover to your premium typically ranges from $50 to $100 per year for a vehicle like your 2010 Honda Civic. It's a small increase in cost for significant additional protection, which can be quite reassuring, especially when you're already budgeting carefully.",0.3333333333333333
91,15,"Okay, that doesn't sound too bad. What about discounts?","Since you're renewing with us, you qualify for a loyalty discount. This discount rewards long-term customers with reduced premiums upon policy renewal, recognizing their loyalty and consistent risk profile over time.","Absolutely, let's explore those discounts. With Reliance General Insurance, we often have special offers that can help lower your premiums. For instance, there are discounts for safe driving records or for bundling your car insurance with other policies, like home insurance. I can help you check whether you qualify for any such offers, ensuring you get the best possible value for your coverage.",0.20618556701030927
92,16,"Hi, I'm interested in getting motor insurance for my bike. It's a 2022 Royal Enfield Interceptor 650.",Great choice! The Interceptor 650 is a fantastic bike. Do you use it for daily commuting or mostly for weekend rides?,"Hello! I'd be happy to help you secure insurance for your 2022 Royal Enfield Interceptor 650. To provide you with the best quote, could you share more details about its usage and if you're interested in any specific coverage options?",0.15873015873015875
93,16,Mostly weekend rides. I like to take it out on the open road when I have time.,"I understand. Given that you enjoy weekend rides, having comprehensive coverage will give you peace of mind on those long journeys. Imagine being stranded far from home due to a breakdown; our roadside assistance can be a lifesaver.","It's great to hear that you enjoy riding your Royal Enfield Interceptor 650 on the weekends that's the perfect way to unwind and enjoy the scenery. When considering insurance, we'll take into account that you use it for leisure rides, which generally means you might benefit from a policy tailored to that. Let's discuss the details and find the best coverage for you.",0.20952380952380953
94,16,Roadside assistance does sound good. What exactly does your comprehensive policy cover?,"It covers accidental damage, theft, natural disasters, and third-party liability. With IFFCO Tokio, you’re choosing a provider known for its customer-first approach and streamlined claims resolution. Their policy ensures clarity and speed during stressful times like accidents or thefts.","Absolutely, I'd be happy to explain. Our comprehensive policy covers not just the bike but also includes roadside assistance for those unexpected breakdowns, so you'll have support wherever you are. Let's dive into the specifics to ensure you have all the coverage you need for your weekend adventures.",0.1075268817204301
95,16,"Okay, good to know. How much would a comprehensive policy cost me?","For a 2022 Royal Enfield Interceptor 650, the comprehensive policy would be around $850 per year. Also as you're a professional and use your bike only for occasional drives, we can offer a discount.","Of course, I can provide some guidance on that. The cost of a comprehensive policy for your Royal Enfield Interceptor 650 will vary based on several factors, including your riding habits and location. To give you an accurate quote, could you tell me more about where you'll be riding mostly and how often?",0.3146067415730337
96,16,That sounds reasonable. Does it include zero depreciation?,"We can add a zero depreciation cover for an additional $100 per year. This ensures that in the event of a claim, the repair or replacement costs are calculated based on the current market value of new parts, rather than depreciated values, offering maximum reimbursement.","Thank you for your interest in a comprehensive policy. Yes, our plan does include zero depreciation, which is especially beneficial for occasional riders like yourself. It ensures that the insured value of your Royal Enfield Interceptor 650 is protected against wear and tear over the policy term, giving you even more peace of mind for your weekend adventures.",0.23300970873786406
97,16,"Okay, that's good to know. I'm interested. Can you send me a quote with and without the zero depreciation cover?","Absolutely! I'll email you both quotes right away. Many of our clients opt for the zero depreciation cover, as it can save you a lot of money in the long run.",Certainly! I'll have a quote for both options sent to you shortly. It's great to see you're considering all the benefits of motor insurance for your Royal Enfield Interceptor 650.,0.3384615384615385
98,17,"Hi, I'm looking to get insurance for my bike. It's a 2022 Yamaha MT-07.","Great choice, the MT-07 is a fantastic bike! Since you're a daily commuter, have you considered a comprehensive plan that covers everything from accidents to theft?","Hello! I'd be happy to assist you with that. The 2022 Yamaha MT 07 is a fantastic bike, and getting the right insurance is important. I can help you find the best options for motorcycle insurance tailored to your model. Let's get started!",0.3013698630136986
99,17,"Yeah, I was thinking comprehensive would be best. I commute in heavy traffic, so I want to be covered. What are my options?","Accidents are unpredictable, but the financial stress doesn’t have to be. Bajaj Allianz offers prompt claims settlement, so you can focus on getting back on the road, not paperwork.","Absolutely, I understand the importance of being thoroughly covered, especially in bustling traffic. There are several comprehensive coverage options, including collision, theft, and personal injury protection that you might find suitable for your daily commute. Let's review them to find the best match for your needs.",0.1558441558441558
100,17,"Okay, good to know. What kind of coverage levels are we talking about?","We can tailor the coverage to your needs. For example, a comprehensive policy with IFFCO Tokio covers key risks such as accidents and theft. It simplifies the claims process through a well-organized system that focuses on customer ease and timely resolution, ensuring clarity and efficiency throughout the insurance experience.","I'm glad to see you're considering comprehensive coverage. The options vary, but typically, there are different levels you can choose from that offer varying degrees of protection, including for theft and accidents. Bajaj Allianz, for instance, prides itself on quick settlements which minimize financial strain. Let's dive into the details to find the perfect fit for your 2022 Yamaha MT 07 and your commuting habits.",0.25423728813559326
101,17,That sounds pretty good. What about add-ons? Are there any I should consider?,"Since you commute daily, Roadside Assistance is invaluable. This service ensures that help is available at any time if you experience vehicle breakdowns, requiring towing services, tire changes, fuel delivery, or emergency repairs while on the road.","Certainly, it's a good idea to explore add ons, especially since you're commuting regularly. An add on like a no claims bonus can save you money over time. Additionally, you might want to consider personal accident coverage for extra peace of mind. Both options can provide extra security for your daily rides. I'm here to help you find the perfect add ons for your lifestyle and needs.",0.16822429906542052
102,17,"Roadside assistance does sound useful. Okay, what's the damage? How much would all of this cost?","For a 2022 Yamaha MT-07 with comprehensive coverage and roadside assistance, you're looking at around $950 annually. This is one of our most popular plans—most of our clients go for it because it’s affordable and offers complete peace of mind for daily drivers","Certainly, I understand that getting a clear picture of the costs is important to you. The comprehensive policy with IFFCO Tokio typically ranges based on various factors, but for a 2022 Yamaha MT 07, you can expect it to be competitively priced, especially when you add Roadside Assistance. To give you an exact quote, we can use our online quote tool or I can connect you with a representative who can provide you with a detailed breakdown and discuss any additional add ons you might find beneficial for your daily commute. How would you like to proceed?",0.25
103,17,That sounds reasonable. Can you send me a quote with all the details?,"Absolutely! I'll email you a detailed quote right away. It will outline all the coverage and benefits. Since you prefer self-service options, Tata AIG’s policy with Online Policy Management suits your tech-savvy lifestyle.","Thank you for considering us for your insurance needs. Your choice of a 2022 Yamaha MT 07 is excellent. For a comprehensive policy that covers everything, including accident and theft protection, Bajaj Allianz offers not only peace of mind but also timely and efficient claim processes, which is ideal for your daily commutes. Considering your requirements, our Roadside Assistance add on is worth considering, especially for daily commuters. It ensures help is just a call away during any vehicle breakdowns or emergencies. The annual cost for the comprehensive plan and Roadside Assistance is $950, a popular choice among our clients for its affordability and complete protection. I'll send you a detailed quote for your review. Rest assured, we're here to make sure you have a hassle free insurance experience.",0.15476190476190477
104,18,"Hi, I'm looking to get insurance for my bike. It's a 2022 Yamaha MT-07.","Great choice! The Yamaha MT-07 is a fantastic bike. Since you're a professional and likely use your bike for daily commuting, let's explore options that offer robust protection and convenience.",Hello there! I'd be happy to assist you with that insurance quote for your 2022 Yamaha MT 07. Let's take a look at the options that would be best suited for your bike.,0.3823529411764706
105,18,"Yes, I use it every day for my commute. What kind of coverage do you recommend?","Given your daily commute, a comprehensive policy with roadside assistance is highly recommended. You never know when you might face a breakdown or flat tire, especially during rush hour.","Absolutely, I'd be happy to help you with that. Based on your bike's model and your daily commuting needs, I'd recommend looking into our comprehensive coverage plans. These plans typically include protection against theft, accidental damage, and third party liability, which is crucial for someone who uses their bike as much as you do. Additionally, considering your professional use, our personal accident cover could be an added layer of security for you. Let's make sure you're well covered on the road.",0.15652173913043477
106,18,Roadside assistance sounds useful. What else does the comprehensive policy cover?,"It covers accidental damage, theft, and third-party liability. Imagine someone were to damage your bike while it's parked; our policy would cover the repair costs.","Absolutely, the comprehensive policy includes not only roadside assistance but also covers theft, vandalism, and damage from natural disasters. It's designed to give you peace of mind with a wide range of protection.",0.29508196721311475
107,18,"Okay, that sounds good. Which company do you recommend?",I would recommend Bajaj Allianz. They are known for their quick claim settlements and reliable customer service. Choosing Bajaj Allianz offers you peace of mind during stressful times.,"It's wonderful to hear that you're interested in a comprehensive policy for your Yamaha MT 07. The coverage options we've discussed seem to fit your needs well, offering peace of mind for both theft and accidental damage. For your daily commutes, the roadside assistance would be an excellent choice. Based on your needs, I'd recommend our trusted partner, 'XYZ Insurance'. They have an excellent reputation for customer satisfaction and robust protection services. Would you like to proceed with this option?",0.23214285714285718
108,18,And what's the premium for the comprehensive policy with Bajaj Allianz?,"For your 2022 Yamaha MT-07, the annual premium would be approximately $1200. This includes comprehensive coverage and roadside assistance.","Absolutely, the comprehensive policy with Bajaj Allianz typically ranges based on various factors, including the bike's value and your usage patterns, but you can expect a competitive rate for the robust protection it offers. If you're ready, I can provide a quote tailored to your needs. What do you think?",0.16666666666666669
109,18,That sounds pretty reasonable. I am interested in the policy. Can I get additional discount on it?,"Yes, since you commute everyday, we can offer you a discount under the commuter discount policy. And with Bajaj Allianz, you’re choosing a provider known for its customer-first approach and streamlined claims resolution.","It's great to hear that you're considering the comprehensive policy with Bajaj Allianz. Absolutely, let me check if there are any available discounts for you. We value your business and want to ensure you get the best possible coverage at a fair price.",0.35000000000000003
110,19,"Hi, I am looking for a motor insurance policy for my bike. It's a 2022 Royal Enfield Classic 350.","Okay, great! The Royal Enfield Classic 350 is a fantastic bike. Since you are a daily commuter, comprehensive coverage is usually a good option. It covers not just third-party liabilities, but also damages to your bike.",Hello! I'd be happy to assist you in finding the right insurance policy for your 2022 Royal Enfield Classic 350. Let's explore your options to ensure you get the coverage you need.,0.28169014084507044
111,19,What all is covered in a comprehensive policy?,"A comprehensive policy typically includes coverage for accidents, theft, natural disasters, fire, and vandalism. With Bajaj Allianz, we also ensure that claims are settled quickly. With Bajaj Allianz, you can focus on recovery, not paperwork.","Certainly! A comprehensive policy typically includes coverage for damage to your bike, theft, vandalism, and natural disasters. It also covers third party liabilities, should you be involved in an accident. Rest assured, you'll be well protected with such a policy for your Royal Enfield Classic 350.",0.39024390243902435
112,19,That sounds good. What would be the premium for a comprehensive policy?,"For a 2022 Royal Enfield Classic 350, a comprehensive policy would be around $950 annually. Because you are a daily commuter and value financial security, we believe that this policy suits you best.","Certainly, the premium for a comprehensive policy varies based on a few factors, but for a bike like your Royal Enfield Classic 350, it's designed to be competitive and affordable. We can provide a personalized quote if you'd like. Would you be interested in discussing your specific details?",0.38554216867469876
113,19,Are there any add-ons available with this policy?,"Yes, we have several add-ons like Zero Depreciation Cover and Roadside Assistance. As a daily rider, Roadside Assistance could be particularly useful in case of a breakdown.","Absolutely, we have a variety of add ons available to enhance your comprehensive policy. These can include coverage for custom parts, extended warranty, and even roadside assistance. It's always a good idea to review your options to customize your policy to best fit your needs. Would you like me to go over the details of these add ons?",0.25287356321839083
114,19,What is Zero Depreciation Cover?,"Zero Depreciation Cover ensures that in the event of a claim, the repair or replacement costs are calculated based on the current market value of new parts, rather than depreciated values, offering maximum reimbursement. Accidents are unpredictable, and you can be financially prepared by taking this add-on. ","I'm glad you're considering the comprehensive policy for your Royal Enfield Classic 350. Zero Depreciation Cover is an add on that ensures you don't lose out on claim amounts due to depreciation. It's particularly useful for a bike like yours, which retains its value over time. Would you like me to add this to your policy?",0.2777777777777778
115,19,"Okay, that makes sense. How much would the policy cost with Zero Depreciation and Roadside Assistance?","With those add-ons, the premium would be approximately $1200 per year. Our policy ensures clarity and speed during stressful times like accidents or thefts. It’s a good choice if you are looking for complete peace of mind.","Absolutely, taking into account the add ons you're interested in, the policy with Zero Depreciation Cover and Roadside Assistance would be around $1,200 annually. This option offers the added peace of mind and security for your commuting needs.",0.32911392405063294
116,19,That sounds like a good deal. Can you send me more details about the policy?,Certainly! I will email you a detailed brochure with all the coverage details and terms and conditions. This is one of our most popular plans—most of our clients go for it because it offers complete peace of mind for daily drivers.,"Certainly, I can provide more details. Our comprehensive policy for the Royal Enfield Classic 350, along with the Zero Depreciation Cover and Roadside Assistance add ons, offers thorough protection, ensuring your vehicle's safety and financial security. You'll receive a clear and swift claims process, with the estimated annual premium of $1200. This is a great option for riders like you who prioritize complete peace of mind. Let me send you the detailed policy documentation right away.",0.35000000000000003
117,20,I need to insure my 2024 Tesla Model 3. What are my options?,"The Tesla Model 3 is an excellent vehicle. As a business owner, you likely appreciate efficiency and reliability. HDFC ERGO General Insurance focuses on delivering prompt assistance and support around the clock, ensuring that any claims or inquiries are handled efficiently at any time.",I'd be happy to help with that! There are several options available for insuring your 2024 Tesla Model 3. We offer a range of coverage plans tailored to EVs. Let's get you a quote to see what fits your needs best.,0.1839080459770115
118,20,What kind of coverage do you recommend?,"Given that it’s a new and valuable car, I strongly recommend a comprehensive policy that includes Zero Depreciation cover and Insured Declared Value (IDV).","Absolutely, I can help with that. For your 2024 Tesla Model 3, a comprehensive coverage plan would be ideal. It would include protection against a variety of potential risks, ensuring that your vehicle is well protected. HDFC ERGO General Insurance offers a range of options tailored to EVs like yours, so you can enjoy peace of mind on the road.",0.21176470588235294
119,20,Why is IDV important?,"IDV ensures you receive the original invoice value in the event of a total loss. In the case of a total loss, this cover guarantees that the payout will match the original purchase price of the vehicle as per the invoice, rather than the depreciated current value, providing greater financial relief.","I'm glad you asked about IDV. It's essentially the maximum amount the insurer will reimburse, without considering depreciation, in case of a total loss. This ensures you get the best possible value for your car, reflecting its actual market value at the time of the incident. It's especially beneficial for newer cars like your Tesla Model 3.",0.36036036036036034
120,20,And what about coverage for the battery? It’s an electric car.,"Our comprehensive policy covers the battery against damage from accidents, fire, and certain types of malfunctions. Think of it as an investment in your safety and security. Accidents happen, and the cost of repairs can be significant.","It's great that you're considering insurance for your new Tesla Model 3. A comprehensive policy with Zero Depreciation cover and Insured Declared Value is indeed recommended for new vehicles like yours. For the battery, our policy specifically includes coverage for electric vehicle batteries to ensure you are fully protected. The IDV is crucial as it guarantees a payout equal to the original purchase price in case of a total loss, which is especially beneficial for electric cars due to their battery costs. Rest assured, we'll make sure you have the coverage you need for your EV.",0.20588235294117646
121,20,How much will all this cost?,"For a 2024 Tesla Model 3 with comprehensive coverage, Zero Depreciation, and IDV, the annual premium would be around $4200. Because you are a business owner and prioritize complete peace of mind, we can customize this policy to best suit you.","The cost of your insurance policy will depend on various factors, including the comprehensive coverage you've opted for, but rest assured, it's designed to be affordable while providing the protection you need. I can guide you through the specifics or put you in touch with our team for a detailed quote.",0.2765957446808511
122,20,That's a bit expensive. Are there any discounts available?,"Yes, we offer a digital purchase discount if you buy the policy online. Also, since you may not be driving as much, we can look at usage-based insurance to bring down the premium a bit, which rewards you for safe driving habits.","I understand your concern about the price — discounts can certainly help. As a business owner, we value your need for affordability. We offer various discount options that could lower your premium, including loyalty benefits and safe driving rewards. I'd be happy to explore these with you to find the best fit for your needs.",0.346938775510204
