id,conversation_id,user_query,agent_reply,all expterts response,rouge
1,1,"Hi, I'm looking to get motor insurance for my new electric vehicle. It's a 2024 Tesla Model 3.","Great choice! The Tesla Model 3 is an excellent vehicle. Since you've opted for an EV, are you particularly interested in coverage specific to electric vehicles, like battery protection?","Hello! I'd be happy to help you with a motor insurance quote for your brand new Tesla Model 3. Since it's an electric vehicle, we'll ensure you get coverage tailored to its unique features. Let's get started!",0.3380281690140845
2,1,"Yes, battery protection is definitely a concern. It's a big investment, and I want to make sure it's covered.","Absolutely. The battery is the heart of your Tesla. With Tata AIG, you get rapid claims resolution combining thorough coverage with rapid claims resolution. It integrates technology with traditional risk management practices, ensuring that claims are processed quickly and effectively.","Absolutely, I understand your concern about protecting your investment, especially when it comes to the battery of your Tesla Model 3. Battery protection is indeed a significant aspect of electric vehicle insurance. Let me explore the options that specifically cover this for you.",0.26506024096385544
3,1,What kind of coverage options do you have specifically for EVs?,"We offer a comprehensive plan that includes coverage for accidental damage, theft, and third-party liability. More importantly, we offer add-ons like Zero Depreciation Cover and Engine & Gearbox Protection. And our online policy management system makes everything simple for someone like you.","Certainly! For electric vehicles like your Tesla Model 3, we offer specific coverage options that address unique aspects such as battery protection. These options include comprehensive coverage that covers battery damage from accidents, as well as dedicated coverage for battery malfunctions and degradation over time. We've tailored these to ensure your investment is safeguarded. Let me know if you want to delve into the details of each option.",0.26785714285714285
4,1,"Okay, that sounds pretty good. Can you give me a quote?","Sure. For a 2024 Tesla Model 3 with comprehensive coverage including battery protection and roadside assistance, the annual premium would be approximately $2800. This includes a discount for purchasing the policy online.","Thank you for considering Tata AIG for your Tesla Model 3 insurance. We're delighted to help you secure your investment with our comprehensive plan, which includes zero depreciation cover, engine & gearbox protection, and more. I'll be happy to provide you a tailored quote to suit your needs. How does that sound?",0.28235294117647064
5,1,That's within my budget. What's the claim process like if I need to use it?,"The claim process is designed to be as smooth and hassle-free as possible. Accidents are unpredictable, but the financial stress doesn’t have to be. We offer prompt claims settlement, so you can focus on recovery, not paperwork. Our team is available 24/7 to guide you through the process.","I'm glad to hear the quote fits your budget. Our claim process is designed to be user friendly. If you need to file a claim, you can do it online easily. We aim to resolve claims swiftly, while ensuring thorough coverage for your Tesla Model 3. The policy includes a dedicated support team for EV related concerns, so you'll have the support you need when you need it.",0.33057851239669417
6,2,"Hi, I'm looking to get insurance for my bike. It's a 2022 Royal Enfield Interceptor 650.","The Interceptor 650 is an excellent bike! As a professional, do you use it mainly for leisure or commuting?","Hello there! It sounds like you're interested in insuring your new 2022 Royal Enfield Interceptor 650, which is a great choice. I'd be happy to help you find a suitable insurance policy. Can you tell me a bit more about where you typically ride and any additional coverage you might be considering?",0.1643835616438356
7,2,"Mostly for weekend rides, so leisure I guess.","Since you are not a daily commuter, you might not need the most expensive plan out there. However, accidents can still happen, especially on leisure rides. Our comprehensive plan ensures you're financially protected from unexpected damages.","Hello! It's great to hear that you enjoy weekend rides with your 2022 Royal Enfield Interceptor 650. Based on your leisure use, I'll tailor an insurance quote for you that covers all the necessary aspects. One moment while I prepare that for you.",0.17073170731707318
8,2,What's covered in a comprehensive plan?,"It covers damages to your bike from accidents, theft, natural disasters, and third-party liabilities. Tata AIG is designed to address modern vehicle risks, this insurance product combines thorough coverage with rapid claims resolution.","Comprehensive plans typically cover a wide range of incidents, such as theft, vandalism, and accidental damage. They are designed to give you peace of mind while enjoying your bike rides. If you have more specific questions or need further details, I'm here to help!",0.2278481012658228
9,2,"Okay, that sounds good. What about roadside assistance?","Roadside assistance is available as part of our comprehensive coverage and offers help if you experience vehicle breakdowns, requiring towing services, tire changes, fuel delivery, or emergency repairs while on the road.","That's a great question. Roadside assistance is indeed part of our comprehensive plan. It's designed to help you in case of any breakdowns or emergencies on the road, providing peace of mind for your weekend rides.",0.4285714285714286
10,2,How much would this cost me?,"For a 2022 Royal Enfield Interceptor 650 with comprehensive coverage, it would be approximately $950 annually. And since you only use your bike for leisure, we can offer a discount making it $850 annually.","Sure, I can provide you with a quote for the comprehensive plan. The cost will vary based on several factors such as your riding area and how often you ride. I'll ensure to get you a competitive rate that matches your requirements.",0.2337662337662338
11,2,That sounds reasonable. I'm happy to pay $850 annually. Please tell me more about the claim process.,It is one of our most sought after policies because it offers excellent value for weekend riders,"I'm glad to hear that the quote sounds reasonable to you. When it comes to the claim process, it's straightforward. If you ever need to file a claim, just get in touch with us through our customer service hotline or mobile app. We'll guide you through the steps, which include reporting the incident, providing necessary documentation, and completing a claim form. Our team will then handle it from there to ensure a smooth resolution.",0.06382978723404255
12,3,"Hi, I'm looking for a motor insurance policy for my bike. It's a 2022 Royal Enfield Classic 350.","Okay, a Royal Enfield Classic 350 is a great bike! Since you're a professional and likely value your time, would you prefer a policy with quick claim settlements or are you more focused on the lowest possible premium?",Hi there! I'd be happy to help you find a motor insurance policy for your 2022 Royal Enfield Classic 350. Let's get started with a quote for you.,0.31884057971014496
13,3,I value my time. Quick claim settlement is important to me.,"I understand. As a professional, you're busy and don't want to be stuck dealing with lengthy claim processes. Bajaj Allianz emphasizes reliability and efficiency, offering extensive vehicle protection while ensuring that claims are settled quickly.","It's great to hear that you value efficiency! We definitely understand the importance of quick claim settlements. Rest assured, we offer policies that prioritize swift service and customer satisfaction.",0.23880597014925373
14,3,What does this policy typically cover?,"It provides Comprehensive Coverage, Liability Coverage, access to our Network Garages, and excellent Customer Support. This is one of our most popular plans—most of our clients go for it because it offers complete peace of mind for daily drivers","Certainly! The policy typically covers damages from accidents, theft, and vandalism, along with third party liabilities. It's designed to offer you peace of mind with a focus on quick claim settlements, just as you need.",0.2105263157894737
15,3,Okay. What would be the premium for this policy?,"For a 2022 Royal Enfield Classic 350, the annual premium would be around $850. This includes quick claim settlements.","The premium for the policy you're interested in is competitively priced, especially considering the comprehensive benefits and quick claim settlement it provides. It's a smart choice for professionals who prioritize efficiency and reliability. Let me get you the exact quote and coverage details.",0.21875
16,3,"That sounds good, can I get paperless claim settlement as part of the deal.","Yes, our policy includes paperless claim settlement, streamlining the claims process through digital submissions and verifications, reducing paperwork and expediting claim settlements in an environmentally friendly manner.","I'm glad you're considering the benefits of a quick claim settlement, and I can confirm that this feature is included in our policies. With Bajaj Allianz, you'll enjoy the convenience of digital paperless claim processing, ensuring a swift resolution for any incidents. There's no need to worry about the details—it's all part of your comprehensive policy.",0.2696629213483146
17,4,"Hi, I am interested in getting motor insurance for my bike. I just bought a new 2024 Royal Enfield Classic 350.","Congratulations on your new Royal Enfield Classic 350! That's a fantastic bike. As a professional, you value efficiency. ICICI Lombard's plan with Cashless Repairs helps you cut unexpected costs and avoid downtime. It’s a smart choice if you value minimal out-of-pocket expense.",Hello and congratulations on your new bike! I can certainly assist you with a motor insurance quote for your Royal Enfield Classic 350. Let's get started.,0.37837837837837834
18,4,Cashless repairs sound good. Does the insurance cover theft as well?,"Yes, it does. Our comprehensive policy covers theft, accidents, and any damages from natural disasters. We also offer roadside assistance in case you ever get stranded.","That's a good question! Theft coverage is indeed part of our comprehensive insurance plans, giving you peace of mind against such risks. If you need more details, I'd be happy to provide them.",0.13114754098360656
19,4,That’s reassuring. What’s the claim process like if something happens?,"With IFFCO Tokio, you’re choosing a provider known for its customer-first approach and streamlined claims resolution. Their policy ensures clarity and speed during stressful times like accidents or thefts.","Absolutely, I can explain that. In the event of an incident, you simply need to inform us, and our team will guide you through the claim process step by step. This typically involves documenting the incident, assessing the damage, and then coordinating with approved repair shops to get your bike fixed with minimal hassle. And remember, with our comprehensive coverage, you're protected against a variety of situations.",0.1414141414141414
20,4,"Okay, that sounds pretty good. What would the premium be for the comprehensive policy?","For a 2024 Royal Enfield Classic 350 with comprehensive coverage, the premium would be around $950 per year. This includes coverage for theft, accidents, and natural disasters, as well as roadside assistance.","Absolutely, I'd be glad to help with that. The premium for the comprehensive policy for your Royal Enfield Classic 350 would be competitive, especially considering the added benefits of cashless repairs and roadside assistance. I can forward your request to get a personalized quote based on your specific needs.",0.39024390243902435
21,4,That sounds reasonable. Let me think about it.,"Consider the peace of mind knowing you're fully protected. Accidents are unpredictable, and the financial strain can be significant. Bajaj Allianz offers prompt claims settlement, allowing you to focus on recovery, not paperwork.","It's great to hear you're taking a moment to think it over. A comprehensive policy like the one we discussed is a solid choice for your new Royal Enfield Classic 350. If you decide to go ahead with it, just let me know and I'll help you with the next steps!",0.1818181818181818
22,5,"Hi, I'm looking for motor insurance for my 2022 Hyundai Kona Electric. Can you help?","Absolutely! The Hyundai Kona Electric is a fantastic car. Given it's an EV, are you particularly concerned about battery coverage or charging-related issues?","Of course, I'd be happy to assist you with finding the right motor insurance for your 2022 Hyundai Kona Electric. Let's explore the options and find a plan that suits your needs.",0.23728813559322035
23,5,"Yes, battery coverage is a big concern. I've heard those repairs can be super expensive.","I understand. With Tata AIG, we understand the nuances of EVs. Our policy is designed to address modern vehicle risks, it ensures claims are processed quickly and effectively.","Certainly, I can understand why battery coverage is a top concern for you — it's a significant aspect of maintaining an electric vehicle. Many insurance policies do offer specific protection for battery systems, so it's worth exploring those options. Let's review your insurance choices together and find a plan that covers your needs comprehensively.",0.19047619047619047
24,5,"Okay, good. What kind of coverage options do you offer for the battery specifically?","We offer a comprehensive plan that includes coverage for accidental damage, theft, and also covers the battery against manufacturing defects and certain types of damage. It's a complete package, offering extensive financial protection.","I completely understand your concern about battery coverage for your Hyundai Kona Electric. It's important to have peace of mind when it comes to the battery's longevity and repair costs. Our policies cover a range of specific battery related issues to ensure you're well protected. Let me detail the options for you, so you can choose the best fit for your needs.",0.2424242424242424
25,5,That sounds reassuring. And what about roadside assistance? Does that cover EVs?,"Yes, our Roadside Assistance covers EVs. It ensures help is available at any time if you experience vehicle breakdowns, requiring towing services, or emergency repairs while on the road.","I'm glad to hear that you feel reassured, and it's great to see you're thinking about the full scope of your insurance. Our roadside assistance does indeed cover EVs, offering services like battery assistance, which can be a big relief for electric vehicle owners. This is designed to help you out if you encounter any issues with your battery on the road.",0.34042553191489366
26,5,What would the annual premium be for a comprehensive policy like that?,"For a 2022 Hyundai Kona Electric with comprehensive coverage, including battery protection and roadside assistance, the annual premium would be around $1200. Since you're a daily commuter, we can also include Online Policy Management suits your tech-savvy lifestyle","Certainly! The annual premium for our comprehensive EV coverage plan varies depending on several factors such as your location, driving history, and the specifics of your Hyundai Kona Electric. However, you can expect competitive rates designed to provide you with peace of mind. I'd be happy to provide a precise quote once we have all the details. Would you like to proceed with a quote?",0.3584905660377358
27,5,That's within my budget. Can you send me a detailed quote with all the inclusions?,Of course! I'll email you a detailed policy brochure and a personalized quote outlining all the benefits and coverage options. This is our most popular plan!,"Certainly! I'll arrange for a detailed quote to be sent to you, featuring comprehensive coverage that includes battery protection and roadside assistance. You've mentioned a budget of around $1200, and with our Online Policy Management feature, it's a great fit for your needs. I'll ensure the quote is detailed and gets to you promptly.",0.3529411764705883
28,6,I need insurance for my 2018 Honda CBR250R. What are my options?,"Okay! First, are you primarily concerned with just meeting the minimum legal requirements, or are you looking for more comprehensive protection?",Finding the right insurance for your 2018 Honda CBR250R is important to keep you protected on the road. We have a variety of options that can be tailored to your specific needs. I can assist you with getting a quote that fits your requirements.,0.21538461538461537
29,6,"Well, I'm a student, so budget is definitely a concern. But I also don't want to be completely exposed if something happens.","Given your situation as a student, Bajaj Allianz offers prompt claims settlement, so you can focus on recovery, not paperwork.","Absolutely, I understand the importance of finding an insurance plan that fits both your budget and coverage needs. Let's explore some student friendly options that could offer the protection you're looking for without breaking the bank.",0.13793103448275862
30,6,"Okay, what's the difference in price between the minimum and a more comprehensive option?","For a 2018 Honda CBR250R, a third-party liability policy, which is the minimum, would be around $300 per year. A comprehensive policy, covering damage to your bike as well, would be about $500.","Certainly! For a basic policy that covers legal requirements, you'd be looking at a lower premium, which we can help you with. On the other hand, a more comprehensive plan offers greater protections and would be slightly higher in cost. Let's find the right balance for your budget and peace of mind.",0.29545454545454547
31,6,"Hmm, $200 is a decent jump. What does the comprehensive policy actually cover on my bike?","It covers accidental damage, theft, fire, and natural disasters. And with IFFCO Tokio, you’re choosing a provider known for its customer-first approach and streamlined claims resolution. Their policy ensures clarity and speed during stressful times like accidents or thefts.","While the added cost for comprehensive coverage is indeed a bit more, it provides peace of mind by covering damages to your bike, which could significantly help in case of an unexpected incident. It's a balance between affordability and security, and we're here to help you find the best fit for your needs and budget.",0.22448979591836735
32,6,"Okay, that does sound better than just liability. Do you offer any discounts for students?","Yes, because you are a student and drive occasionally, we can offer you a discount on the comprehensive policy. It's a popular choice amongst students because it's affordable and offers complete peace of mind for daily drivers","Absolutely, I understand that as a student, finding the right balance between cost and coverage is important. Many insurers recognize that students are budget conscious and often provide discounts. Let's explore this together, and I'll help you find a plan that offers the protection you need without stretching your finances too thin.",0.27956989247311825
33,7,I'm looking for insurance for my 2020 Maruti Suzuki Baleno. Can you help me with that?,"Certainly! The Maruti Suzuki Baleno is a great car. Given that you likely use it for family commutes, what are your primary concerns?","Absolutely, I'd be happy to assist you with that! Insuring your 2020 Maruti Suzuki Baleno is a smart choice. To provide you with an accurate quote, I'll need a bit more information, such as your location and any additional coverage you might be interested in. Let's get started!",0.21621621621621623
34,7,Safety for my family is my top priority. I want to make sure everyone is covered in case of an accident.,"I understand completely. Accidents are unpredictable, but the financial stress doesn’t have to be. HDFC ERGO policy is crafted to meet specific vehicle protection needs by providing clear, understandable coverage terms","It's wonderful to hear that you're enjoying your Maruti Suzuki Baleno! The performance and handling certainly seem to be a great fit for your commutes. If you ever need assistance or have questions about insurance, we're here for you and your family's safety.",0.1518987341772152
35,7,What kind of personal accident cover do you offer for passengers?,"Our Personal Accident Cover provides additional financial support in case of serious injury or death resulting from a road accident, covering medical expenses, disability, or loss of income for the insured driver and eligible passengers.","I understand your concern about passenger safety, and personal accident cover is an essential part of our insurance policies. It provides financial protection for passengers in the event of an accident.",0.4545454545454545
36,7,"That's good to know. I also worry about the car getting damaged, especially with kids around!","Then you'll definitely want comprehensive coverage. It covers damages to your vehicle due to accidents, theft, natural disasters, fire, and vandalism, offering extensive financial protection beyond just third-party coverage.","Absolutely, I understand your concern. Our policy ensures that not only are your family members covered in case of any unfortunate event, but it also protects your vehicle from potential damage. It's designed to provide peace of mind, knowing that both your loved ones and your car are well protected.",0.1951219512195122
37,7,What's the claim process like? I don't want a lot of hassle if I need to make a claim.,We pride ourselves on our streamlined claim process and customer support. Our claims process is designed to be simple and efficient.,"Absolutely, I can help with that. HDFC ERGO's claim process is streamlined to make it as hassle free as possible. Whether it's a minor incident or a major accident, our team is here to guide you every step of the way. For your 2020 Maruti Suzuki Baleno, you have the peace of mind that comes with comprehensive coverage that extends beyond just third party damages. And don't worry, our Personal Accident Cover is designed to protect your family too. We're here to ensure your protection is as comfortable as your car ride.",0.17094017094017094
38,7,"Okay, that's reassuring. How much would a comprehensive policy with personal accident cover cost for my Baleno?","For a 2020 Maruti Suzuki Baleno with comprehensive coverage and personal accident cover, the annual premium would be approximately $950. Since you are a daily commuter and drive your family, we can offer you Cashless Repair Network that allows policyholders to have their vehicle repairs handled directly by approved service centers without paying upfront","It sounds like safety is your main focus, which is important. For comprehensive coverage on a Maruti Suzuki Baleno, including personal accident cover, the premium will depend on various factors like the car's age and your driving record. I can provide you with a detailed quote to ensure it fits your family's needs and gives you peace of mind.",0.39999999999999997
39,8,"Hi, I'm interested in getting insurance for my bike, a 2022 Royal Enfield Interceptor 650.","Great choice! The Interceptor 650 is a fantastic bike. Since you're a professional and likely value your leisure time, how important is a hassle-free claim process to you?","That's great to hear! I can help you get a quote for your bike. The 2022 Royal Enfield Interceptor 650 is a fantastic motorcycle, and it's wise to consider insurance. I'll need a bit more information to provide you with accurate options. Could you tell me if this will be for personal use or a commercial setup?",0.3333333333333333
40,8,A hassle-free claim process is definitely important. I don't want to spend hours on paperwork if something happens.,"I understand. With IFFCO Tokio, you’re choosing a provider known for its customer-first approach and streamlined claims resolution. Their policy ensures clarity and speed during stressful times like accidents or thefts.","I completely understand. A quick and smooth claim process is definitely crucial to your peace of mind. We've streamlined our procedures to ensure that if you ever need to file a claim, it's as easy as possible, with minimal paperwork and fuss.",0.25974025974025977
41,8,"Okay, that sounds promising. What kind of coverage options do you offer?","We offer both comprehensive and third-party liability coverage. Given that you value a hassle-free experience, I highly recommend the comprehensive coverage. It will cover you for a variety of risks including collisions, theft, and incidental damages.","Absolutely! For your 2022 Royal Enfield Interceptor 650, we offer comprehensive coverage options, including theft and accident protection. We ensure a clear and swift claims process, so you can focus on what's important.",0.30555555555555564
42,8,What's the approximate cost difference between the two?,"For your bike, the third-party liability might be around $300 annually, while the comprehensive policy would be approximately $650. Since you're a value-seeker, consider this: the extra $350 could save you thousands in case of an accident or theft.","Looking at the options, comprehensive coverage typically comes at a higher premium due to its broader protection, but it's worth it to ensure peace of mind. I can provide a quote that will give you a clear idea of the cost difference. Would you like me to proceed with that?",0.17204301075268816
